{
	"id": "fs-servicing/corpus/requests-v1",
	"name": "Servicing requests, v1",
	"version": "1",
	"stateKind": "caller-words",
	"guide": "What callers say when they ring the servicing desk, each utterance labelled with the request it makes and the support need it discloses; frozen before Jev saw any of it, so q1 was not tuned against it. Tags: plain (the regex’s own wording), paraphrase, trap (the regex’s words in a sense it does not mean), mixed (a request with a need in passing). Synthetic English written by the product’s authors for the Jev experiment (98-JEV.md §8–§11): no person, number or place in it is real, and no row has a digit. It stands in for what callers say; it is not what they say. A sample of real calls, labelled by someone other than the product’s authors, is the missing test, and no figure measured on these rows replaces it.",
	"labels": {
		"category": {
			"options": ["address", "card", "third-party", "disclosure", "bereavement"],
			"guide": "address — change the address held on the caller’s own account, because they have moved or are moving home. card — replace or stop a bank card that is lost, stolen, damaged, expired or not working. third-party — let another living person access, manage or act on the caller’s account. bereavement — deal with the account of someone who has died. disclosure — none of the above: the caller only tells the bank about their circumstances."
		},
		"need": {
			"options": ["job-loss", "bereavement", "health", "none"],
			"guide": "A need the caller discloses about themselves or someone close: job-loss (lost their job or income from work), bereavement (someone close has died), health (a physical or mental condition, illness, injury, disability or treatment), else none."
		}
	},
	"rows": [
		{
			"id": "a01",
			"state": "I have moved house and need the address on my account changed.",
			"tags": ["plain"],
			"labels": {
				"category": "address",
				"need": "none"
			}
		},
		{
			"id": "a02",
			"state": "Please update my address, I've moved to a new flat.",
			"tags": ["plain"],
			"labels": {
				"category": "address",
				"need": "none"
			}
		},
		{
			"id": "a03",
			"state": "Can you change the postcode on my account? I moved last week.",
			"tags": ["plain"],
			"labels": {
				"category": "address",
				"need": "none"
			}
		},
		{
			"id": "a04",
			"state": "I need to update my home address please.",
			"tags": ["plain"],
			"labels": {
				"category": "address",
				"need": "none"
			}
		},
		{
			"id": "a05",
			"state": "I've relocated to the other side of the city and want my statements going to the right place.",
			"tags": ["paraphrase"],
			"labels": {
				"category": "address",
				"need": "none"
			}
		},
		{
			"id": "a06",
			"state": "We've just bought our first home, so letters should go there from now on.",
			"tags": ["paraphrase"],
			"labels": {
				"category": "address",
				"need": "none"
			}
		},
		{
			"id": "a07",
			"state": "I don't live at the old place any more; can you point the account to where I'm living now?",
			"tags": ["paraphrase"],
			"labels": {
				"category": "address",
				"need": "none"
			}
		},
		{
			"id": "a08",
			"state": "I'm emigrating at the end of the month and the bank needs to know where I'll be living.",
			"tags": ["paraphrase"],
			"labels": {
				"category": "address",
				"need": "none"
			}
		},
		{
			"id": "a09",
			"state": "Change of residence: I'm now living with my sister in the next town.",
			"tags": ["paraphrase"],
			"labels": {
				"category": "address",
				"need": "none"
			}
		},
		{
			"id": "a10",
			"state": "Could you update where you send my correspondence? I've been somewhere new since the spring.",
			"tags": ["paraphrase"],
			"labels": {
				"category": "address",
				"need": "none"
			}
		},
		{
			"id": "a11",
			"state": "Just letting you know my home's changed; I'm in the village now, not the town.",
			"tags": ["paraphrase"],
			"labels": {
				"category": "address",
				"need": "none"
			}
		},
		{
			"id": "a12",
			"state": "Where do I tell you that I live somewhere different now?",
			"tags": ["paraphrase"],
			"labels": {
				"category": "address",
				"need": "none"
			}
		},
		{
			"id": "a13",
			"state": "I've moved onto a new estate and need my details updated.",
			"tags": ["trap"],
			"labels": {
				"category": "address",
				"need": "none"
			}
		},
		{
			"id": "a14",
			"state": "I can't access my post at the old house since I moved, so please update it.",
			"tags": ["trap"],
			"labels": {
				"category": "address",
				"need": "none"
			}
		},
		{
			"id": "a15",
			"state": "My phone died so I couldn't ring sooner — I've moved and need my address updated.",
			"tags": ["trap"],
			"labels": {
				"category": "address",
				"need": "none"
			}
		},
		{
			"id": "a16",
			"state": "My card statements keep going to my old address; I moved out in the summer.",
			"tags": ["trap"],
			"labels": {
				"category": "address",
				"need": "none"
			}
		},
		{
			"id": "a17",
			"state": "The previous owner of my new house passed away, and I have moved in — please update my address.",
			"tags": ["trap"],
			"labels": {
				"category": "address",
				"need": "none"
			}
		},
		{
			"id": "a18",
			"state": "My old job was at the hospital; I have moved house for a new one and need my address changed.",
			"tags": ["trap"],
			"labels": {
				"category": "address",
				"need": "none"
			}
		},
		{
			"id": "a19",
			"state": "I've had to move into sheltered housing after my stroke, so please change my address.",
			"tags": ["mixed"],
			"labels": {
				"category": "address",
				"need": "health"
			}
		},
		{
			"id": "a20",
			"state": "I lost my job so I have moved back in with my parents — can you change my address?",
			"tags": ["mixed"],
			"labels": {
				"category": "address",
				"need": "job-loss"
			}
		},
		{
			"id": "a21",
			"state": "After being let go from the factory I couldn't afford the rent, so I'm somewhere cheaper now. New address please.",
			"tags": ["mixed"],
			"labels": {
				"category": "address",
				"need": "job-loss"
			}
		},
		{
			"id": "a22",
			"state": "Since Mum passed I've moved into her house, so my address needs changing.",
			"tags": ["mixed"],
			"labels": {
				"category": "address",
				"need": "bereavement"
			}
		},
		{
			"id": "a23",
			"state": "I'm moving nearer the hospital for my dialysis, so I need my address updated.",
			"tags": ["mixed"],
			"labels": {
				"category": "address",
				"need": "health"
			}
		},
		{
			"id": "a24",
			"state": "Our family has just settled into a bigger place across town — please update our details.",
			"tags": ["paraphrase"],
			"labels": {
				"category": "address",
				"need": "none"
			}
		},
		{
			"id": "c01",
			"state": "My card has been lost and I need a new one.",
			"tags": ["plain"],
			"labels": {
				"category": "card",
				"need": "none"
			}
		},
		{
			"id": "c02",
			"state": "My debit card was stolen yesterday.",
			"tags": ["plain"],
			"labels": {
				"category": "card",
				"need": "none"
			}
		},
		{
			"id": "c03",
			"state": "The chip on my card has stopped working, can I get a replacement?",
			"tags": ["plain"],
			"labels": {
				"category": "card",
				"need": "none"
			}
		},
		{
			"id": "c04",
			"state": "Please send me a replacement card.",
			"tags": ["plain"],
			"labels": {
				"category": "card",
				"need": "none"
			}
		},
		{
			"id": "c05",
			"state": "I was mugged and they took my bank card.",
			"tags": ["plain"],
			"labels": {
				"category": "card",
				"need": "none"
			}
		},
		{
			"id": "c06",
			"state": "Someone pinched my wallet on the train and I need to stop the plastic and get it replaced.",
			"tags": ["paraphrase"],
			"labels": {
				"category": "card",
				"need": "none"
			}
		},
		{
			"id": "c07",
			"state": "The cash machine swallowed it this morning and wouldn't give it back — I need a replacement to pay for things.",
			"tags": ["paraphrase"],
			"labels": {
				"category": "card",
				"need": "none"
			}
		},
		{
			"id": "c08",
			"state": "My debit's snapped clean in half, can you send another?",
			"tags": ["paraphrase"],
			"labels": {
				"category": "card",
				"need": "none"
			}
		},
		{
			"id": "c09",
			"state": "I've mislaid my contactless and need a new one sent out.",
			"tags": ["paraphrase"],
			"labels": {
				"category": "card",
				"need": "none"
			}
		},
		{
			"id": "c10",
			"state": "The magnetic strip's worn out and shops keep declining me. I need a fresh one.",
			"tags": ["paraphrase"],
			"labels": {
				"category": "card",
				"need": "none"
			}
		},
		{
			"id": "c11",
			"state": "Somebody has been using my debit at petrol stations; I still have it but I want it stopped and replaced.",
			"tags": ["paraphrase"],
			"labels": {
				"category": "card",
				"need": "none"
			}
		},
		{
			"id": "c12",
			"state": "My purse was nicked at the market with my bank stuff in it and I need to stop the one for this account.",
			"tags": ["paraphrase"],
			"labels": {
				"category": "card",
				"need": "none"
			}
		},
		{
			"id": "c13",
			"state": "My card died — it just won't tap any more. Can you send a new one?",
			"tags": ["trap"],
			"labels": {
				"category": "card",
				"need": "none"
			}
		},
		{
			"id": "c14",
			"state": "I can't access my money because my card's been cancelled — I need a new one.",
			"tags": ["trap"],
			"labels": {
				"category": "card",
				"need": "none"
			}
		},
		{
			"id": "c15",
			"state": "The replacement went to the address I moved from, so it has never arrived — please send another card.",
			"tags": ["trap"],
			"labels": {
				"category": "card",
				"need": "none"
			}
		},
		{
			"id": "c16",
			"state": "I'm in hospital and my card's gone missing from the ward — can you replace it?",
			"tags": ["mixed"],
			"labels": {
				"category": "card",
				"need": "health"
			}
		},
		{
			"id": "c17",